5,BAGGEBO 바게보 ,"30,000",https://www.ikea.com/kr/ko/p/baggebo-shelving-unit-metal-white-60483873/,,폭:60 cm 높이:116 cm 깊이:25 cm 선반당 최대하중:12 kg 폭:30 cm 높이:4 cm 길이:122 cm 무게:5.29 kg
5,BAGGEBO 바게보 ,"32,000",https://www.ikea.com/kr/ko/p/baggebo-bookcase-white-10483880/,벽 공간을 최대한 활용해보세요. 공간은 적게 차지하고 다양한 물건을 수납할 수 있습니다.,폭:50 cm 깊이:25 cm 높이:160 cm 선반당 최대하중:8 kg 폭:26 cm 높이:7 cm 길이:164 cm 무게:16.60 kg
5,BILLY 빌리 ,"89,900",https://www.ikea.com/kr/ko/p/billy-bookcase-white-10351568/,세계 어디에선가 5초마다 하나의 BILLY/빌리 책장이 판매되고 있어요. 1979년에 출시한 것을 생각하면 아주 인상적인 수치죠. 세월이 흐를수록 그 멋을 더해가는 근사한 디자인 덕에 여전히 많은 사랑을 받고 있습니다.,폭:80 cm 깊이:28 cm 높이:202 cm 선반당 최대하중:30 kg 폭:29 cm 높이:14 cm 길이:207 cm 무게:40.75 kg
5,LERBERG 레르베리 ,"21,900",https://www.ikea.com/kr/ko/p/lerberg-shelf-unit-white-60168529/,클래식하고 유행을 타지 않는 넉넉한 선반유닛으로 다양한 높이와 크기의 물건들을 보관할 수 있어요. 좋아하는 모든 것들을 진열할 수 있는 완벽한 수납 솔루션이에요.,폭:60 cm 깊이:35 cm 높이:148 cm 선반당 최대하중:10 kg 폭:34 cm 높이:7 cm 길이:112 cm 무게:5.09 kg
5,KALLAX 칼락스 ,"109,000",https://www.ikea.com/kr/ko/p/kallax-shelving-unit-white-20351884/,"세우거나 눕힐 수 있는 KALLAX 칼락스 시리즈는 취향, 공간, 요구사항, 예산에 맞춰 선택할 수 있습니다. 부드러운 표면과 둥근 코너에서 우수한 품질을 느낄 수 있고, 인서트와 상자를 사용해 선반유닛을 맞춤 구성할 수 있어요.",폭:77 cm 깊이:39 cm 높이:147 cm 선반당 최대하중:13 kg 폭:41 cm 높이:17 cm 길이:151 cm 무게:29.60 kg
5,HYLLIS 휠리스 ,"23,000",https://www.ikea.com/kr/ko/p/hyllis-shelving-unit-in-outdoor-10428327/,"실내와 야외의 작은 공간에 실용적인 아연도금스틸 소재의 수납 솔루션입니다. 발코니 또는 주방, 현관, 욕실 어디에든 놓을 수 있습니다. 튼튼하고 가벼우며 물을 사용하는 공간에서 사용할 수 있어요.",폭:60 cm 깊이:27 cm 높이:74 cm 선반당 최대하중:25 kg 폭:30 cm 높이:4 cm 길이:74 cm 무게:3.71 kg
5,BAGGEBO 바게보 ,"35,000",https://www.ikea.com/kr/ko/p/baggebo-cabinet-with-door-white-70483882/,도어는 좌우 어디에든 설치할 수 있습니다.,폭:50 cm 깊이:30 cm 높이:80 cm 선반당 최대하중:8 kg 폭:31 cm 높이:11 cm 길이:84 cm 무게:13.50 kg
5,JONAXEL 요낙셀 ,"60,000",https://www.ikea.com/kr/ko/p/jonaxel-shelving-unit-white-70431317/,깔끔하고 정리된 상태를 유지하는 것이 어려울 수 있습니다. JONAXEL/요낙셀 수납시스템을 사용하면 공간을 스마트한 방식으로 활용할 수 있어요. 습한 욕실이나 다용도실뿐만 아니라 거의 모든 공간의 요건에 딱 맞는 콤비네이션을 구성할 수 있습니다.,폭:80 cm 깊이:38 cm 높이:160 cm 선반당 최대하중:25 kg 폭:44 cm 높이:4 cm 길이:162 cm 무게:14.30 kg
5,LERBERG 레르베리 ,"13,000",https://www.ikea.com/kr/ko/p/lerberg-shelf-unit-white-70315935/,작고 컴팩트한 수납 솔루션을 찾고 있나요? 바로 여기 있습니다. 유행을 타지 않는 클래식한 느낌의 튼튼한 선반유닛으로 모든 크기의 물건을 보관할 수 있는 여러 개의 오픈 선반이 있어요.,폭:60 cm 깊이:35 cm 높이:70 cm 선반당 최대하중:10 kg 폭:36 cm 높이:11 cm 길이:71 cm 무게:2.96 kg
5,LACK 라크 ,"119,000",https://www.ikea.com/kr/ko/p/lack-wall-shelf-unit-white-40282187/,공간이 좁은가요? 빈 벽면이 있나요? 어떤 경우에나 잘 맞는 선반입니다. 공간 구조 및 수납 요구사항에 따라 세로로 또는 가로로 달 수 있습니다.,폭:30 cm 깊이:28 cm 높이:190 cm 최대 하중:25 kg 선반당 최대하중:3 kg 폭:32 cm 높이:11 cm 길이:192 cm 무게:13.26 kg
5,LAIVA 라이바 ,"38,000",https://www.ikea.com/kr/ko/p/laiva-bookcase-black-brown-20178592/,오픈 수납장은 물건을 정리하면서 동시에 개성을 반영할 수 있는 가구입니다. 이 책장은 좋아하는 책과 물건을 잘 보이게 진열할 수 있어요. 깊이가 얕아 작은 공간에 알맞아요.,폭:62 cm 깊이:24 cm 높이:165 cm 선반당 최대하중:15 kg 폭:25 cm 높이:8 cm 길이:119 cm 무게:13.87 kg
5,BILLY 빌리 ,"69,900",https://www.ikea.com/kr/ko/p/billy-bookcase-white-70351570/,세계 어디에선가 5초마다 하나의 BILLY/빌리 책장이 판매되고 있어요. 1979년에 출시한 것을 생각하면 아주 인상적인 수치죠. 세월이 흐를수록 그 멋을 더해가는 근사한 디자인 덕에 여전히 많은 사랑을 받고 있습니다.,폭:80 cm 깊이:28 cm 높이:106 cm 선반당 최대하중:30 kg 폭:30 cm 높이:15 cm 길이:108 cm 무게:22.90 kg
5,BAGGEBO 바게보 ,"25,000",https://www.ikea.com/kr/ko/p/baggebo-bookcase-white-10483875/,벽 공간을 최대한 활용해보세요. 공간은 적게 차지하고 다양한 물건을 수납할 수 있습니다.,깊이:30 cm 높이:80 cm 선반당 최대하중:6 kg 폭:50 cm 폭:31 cm 높이:9 cm 길이:84 cm 무게:10.60 kg
5,KALLAX 칼락스 ,"169,000",https://www.ikea.com/kr/ko/p/kallax-shelving-unit-white-60409939/,"세우거나 눕힐 수 있는 KALLAX 칼락스 시리즈는 취향, 공간, 요구사항, 예산에 맞춰 선택할 수 있습니다. 부드러운 표면과 둥근 코너에서 우수한 품질을 느낄 수 있고, 인서트와 상자를 사용해 선반유닛을 맞춤 구성할 수 있어요.",폭:112 cm 깊이:39 cm 높이:147 cm 선반당 최대하중:13 kg 폭:41 cm 높이:11 cm 길이:144 cm 무게:18.80 kg 폭:40 cm 높이:13 cm 길이:143 cm 무게:23.19 kg
5,FJÄLKINGE 피엘킹에 ,"199,000",https://www.ikea.com/kr/ko/p/fjaelkinge-shelving-unit-white-70221687/,길고 얇은 선반으로 구성되어 있으며 공기처럼 가벼운 느낌을 줍니다. 깔끔하고 단순한 디자인으로 다양한 스타일의 가구와 조합할 수 있습니다.,폭:118 cm 깊이:35 cm 높이:193 cm 최대 하중:40 kg 선반당 최대하중:40 kg 폭:36 cm 높이:12 cm 길이:120 cm 무게:28.04 kg 폭:6 cm 높이:5 cm 길이:191 cm 무게:7.50 kg
5,BILLY 빌리 ,"209,700",https://www.ikea.com/kr/ko/p/billy-bookcase-white-s79184478/,세계 어디에선가 5초마다 하나의 BILLY/빌리 책장이 판매되고 있어요. 1979년에 출시한 것을 생각하면 아주 인상적인 수치죠. 세월이 흐를수록 그 멋을 더해가는 근사한 디자인 덕에 여전히 많은 사랑을 받고 있습니다.,폭:240 cm 깊이:28 cm 높이:106 cm 선반당 최대하중:30 kg 폭:30 cm 높이:15 cm 길이:108 cm 무게:22.90 kg
5,BILLY 빌리 ,"109,900",https://www.ikea.com/kr/ko/p/billy-bookcase-with-drawer-white-s09487841/,,폭:80 cm 깊이:30 cm 높이:106 cm 선반당 최대하중:30 kg 서랍깊이(내부):25 cm 서랍당 최대 하중:9 kg 서랍폭(내부):73 cm 폭:35 cm 높이:5 cm 길이:85 cm 무게:7.98 kg 폭:30 cm 높이:15 cm 길이:108 cm 무게:22.90 kg
5,KALLAX 칼락스 ,"69,900",https://www.ikea.com/kr/ko/p/kallax-shelving-unit-white-40351883/,"벽에 걸거나 단독으로 세워 놓을 수 있습니다. KALLAX 칼락스 시리즈를 원하는 대로 유연하게 사용해보세요. 부드러운 표면과 둥근 코너에서 우수한 품질을 느낄 수 있고, 인서트와 상자를 사용해 선반유닛을 맞춤 구성할 수 있어요.",폭:42 cm 깊이:39 cm 높이:147 cm 선반당 최대하중:13 kg 벽 캐비닛당 최대 하중:30 kg 폭:41 cm 높이:12 cm 길이:155 cm 무게:17.54 kg
5,EKENABBEN 에케나벤 ,"89,900",https://www.ikea.com/kr/ko/p/ekenabben-open-shelving-unit-aspen-white-60487814/,쉽게 조립할 수 있습니다.,"프레임, 깊이:34 cm 프레임 높이:154 cm 프레임 폭:70 cm 선반당 최대하중:20 kg 폭:38 cm 높이:9 cm 길이:82 cm 무게:9.33 kg 폭:9 cm 높이:7 cm 길이:164 cm 무게:3.69 kg"
5,LERBERG 레르베리 ,"17,900",https://www.ikea.com/kr/ko/p/lerberg-shelf-unit-white-00168527/,"클래식하고 유행을 타지 않는 선반유닛으로, 선반 크기와 선반 사이의 간격이 다양해서 모든 높이와 크기의 물건들을 보관할 수 있어요. 좋아하는 모든 것들을 진열할 수 있는 완벽한 솔루션이에요.",폭:35 cm 깊이:35 cm 높이:148 cm 선반당 최대하중:10 kg 폭:31 cm 높이:5 cm 길이:110 cm 무게:4.17 kg
5,BILLY 빌리 ,"69,900",https://www.ikea.com/kr/ko/p/billy-bookcase-white-40351543/,세계 어디에선가 5초마다 하나의 BILLY/빌리 책장이 판매되고 있어요. 1979년에 출시한 것을 생각하면 아주 인상적인 수치죠. 세월이 흐를수록 그 멋을 더해가는 근사한 디자인 덕에 여전히 많은 사랑을 받고 있습니다.,폭:40 cm 깊이:28 cm 높이:202 cm 선반당 최대하중:14 kg 폭:39 cm 높이:7 cm 길이:206 cm 무게:26.90 kg
5,KALLAX 칼락스 ,"139,000",https://www.ikea.com/kr/ko/p/kallax-shelving-unit-with-underframe-white-white-s89471676/,KALLAX 칼락스는 라인이 깔끔하고 디자인이 심플해서 유연한 구성이 가능하고 집에서 간편하게 사용할 수 있습니다. ​,폭:147 cm 깊이:39 cm 높이:94 cm 선반당 최대하중:13 kg 폭:41 cm 높이:17 cm 길이:151 cm 무게:29.60 kg 폭:24 cm 높이:5 cm 길이:152 cm 무게:4.83 kg
5,FLYSTA 플뤼스타 ,"79,900",https://www.ikea.com/kr/ko/p/flysta-shelving-unit-white-10378006/,FLYSTA/플뤼스타는 단순하고 아담한 선반유닛으로 작은 공간 수납에 딱 맞는 제품입니다. 다양한 수납함을 더해서 더욱 실용적인 수납 솔루션을 구성할 수 있습니다.,폭:69 cm 깊이:31 cm 높이:132 cm 폭:32 cm 높이:15 cm 길이:136 cm 무게:20.80 kg
5,EKENABBEN 에케나벤 ,"59,900",https://www.ikea.com/kr/ko/p/ekenabben-open-shelving-unit-aspen-white-90487817/,쉽게 조립할 수 있습니다.,"프레임, 깊이:34 cm 프레임 높이:86 cm 프레임 폭:70 cm 선반당 최대하중:20 kg 폭:40 cm 높이:6 cm 길이:66 cm 무게:4.91 kg 폭:10 cm 높이:6 cm 길이:132 cm 무게:2.28 kg"
5,BRIMNES 브림네스 ,"139,000",https://www.ikea.com/kr/ko/p/brimnes-bookcase-white-10351686/,잡동사니는 문 뒤에 보이지 않게 넣어두고 좋아하는 물건은 멋지게 진열하세요. 조절식 선반을 사용하면 솔루션을 완벽하게 맞춤 구성할 수 있어요. BRIMNES 브림네스 시리즈를 활용하면 수납 문제가 해결되며 조화롭고 일관성 있는 분위기도 살릴 수 있습니다.,폭:60 cm 깊이:35 cm 높이:190 cm 선반당 최대하중:18 kg 폭:36 cm 높이:11 cm 길이:87 cm 무게:15.50 kg 폭:34 cm 높이:6 cm 길이:194 cm 무게:23.60 kg
5,OMAR 오마르 ,"49,900",https://www.ikea.com/kr/ko/p/omar-shelving-unit-galvanised-00167207/,"OMAR 오마르 수납제품은 주방, 욕실, 현관에 넓은 공간을 제공합니다. 음식이나 수건과 같은 물건이 잘 보이도록 금속 선반에 안전하게 보관할 수 있습니다. 조립이 쉬우며 같은 시리즈의 수납제품들과 함께 사용할 수 있습니다.",폭:92 cm 깊이:36 cm 높이:94 cm 선반당 최대하중:33 kg 폭:37 cm 높이:10 cm 길이:94 cm 무게:9.03 kg
5,KALLAX 칼락스 ,"99,900",https://www.ikea.com/kr/ko/p/kallax-shelving-unit-with-underframe-white-white-s39443983/,KALLAX 칼락스는 라인이 깔끔하고 디자인이 심플해서 유연한 구성이 가능하고 집에서 간편하게 사용할 수 있습니다. ​,폭:147 cm 깊이:39 cm 높이:59 cm 선반당 최대하중:13 kg 폭:24 cm 높이:5 cm 길이:152 cm 무게:4.83 kg 폭:41 cm 높이:12 cm 길이:155 cm 무게:17.54 kg
5,BILLY 빌리 / OXBERG 옥스베리 ,"189,900",https://www.ikea.com/kr/ko/p/billy-oxberg-bookcase-white-s09184486/,유리도어는 내용물이 잘 보이고 먼지가 끼지 않습니다.,폭:80 cm 깊이:30 cm 높이:202 cm 선반당 최대하중:30 kg 폭:29 cm 높이:14 cm 길이:207 cm 무게:40.75 kg 폭:40 cm 높이:3 cm 길이:209 cm 무게:9.26 kg
5,KALLAX 칼락스 ,"134,000",https://www.ikea.com/kr/ko/p/kallax-shelving-unit-with-underframe-black-brown-black-s89443952/,KALLAX 칼락스는 라인이 깔끔하고 디자인이 심플해서 유연한 구성이 가능하고 집에서 간편하게 사용할 수 있습니다. ​,폭:77 cm 깊이:39 cm 높이:164 cm 선반당 최대하중:13 kg 폭:41 cm 높이:17 cm 길이:151 cm 무게:29.60 kg 폭:22 cm 높이:5 cm 길이:82 cm 무게:3.25 kg
5,KALLAX 칼락스 ,"54,900",https://www.ikea.com/kr/ko/p/kallax-shelving-unit-white-70351886/,"벽에 걸거나 단독으로 세워 놓을 수 있습니다. KALLAX 칼락스 시리즈를 원하는 대로 유연하게 사용해보세요. 부드러운 표면과 둥근 코너에서 우수한 품질을 느낄 수 있고, 인서트와 상자를 사용해 선반유닛을 맞춤 구성할 수 있어요.",폭:77 cm 깊이:39 cm 높이:77 cm 선반당 최대하중:13 kg 벽 캐비닛당 최대 하중:20 kg 폭:41 cm 높이:19 cm 길이:82 cm 무게:16.10 kg
5,BERGSHULT 베리스훌트 / PERSHULT 페르스훌트 ,"122,700",https://www.ikea.com/kr/ko/p/bergshult-pershult-wall-shelf-combination-white-white-s39291159/,PERSHULT/페르스훌트 브래킷으로 개성 있는 벽선반을 꾸며보세요. 두 개의 선반을 연결하여 대형 콤비네이션을 구성할 때 잘 맞도록 디자인한 브래킷이어서 원하는 분위기에 맞추어 설치할 수 있습니다.,폭:120 cm 깊이:30 cm 최대 하중:20 kg 폭:31 cm 높이:1 cm 길이:32 cm 무게:0.30 kg 폭:31 cm 높이:3 cm 길이:127 cm 무게:6.68 kg
5,BILLY 빌리 ,"129,900",https://www.ikea.com/kr/ko/p/billy-bookcase-with-drawer-white-s49487839/,,폭:80 cm 깊이:30 cm 높이:202 cm 선반당 최대하중:30 kg 서랍깊이(내부):25 cm 서랍당 최대 하중:9 kg 서랍폭(내부):73 cm 폭:35 cm 높이:5 cm 길이:85 cm 무게:7.98 kg 폭:29 cm 높이:14 cm 길이:207 cm 무게:40.75 kg
5,JONAXEL 요낙셀 ,"40,000",https://www.ikea.com/kr/ko/p/jonaxel-shelving-unit-white-60431313/,깔끔하고 정리된 상태를 유지하는 것이 어려울 수 있습니다. JONAXEL/요낙셀 수납시스템을 사용하면 공간을 스마트한 방식으로 활용할 수 있어요. 습한 욕실이나 다용도실뿐만 아니라 거의 모든 공간의 요건에 딱 맞는 콤비네이션을 구성할 수 있습니다.,폭:50 cm 깊이:51 cm 높이:70 cm 선반당 최대하중:20 kg 폭:56 cm 높이:4 cm 길이:69 cm 무게:7.50 kg
5,JOSTEIN 요스테인 ,"49,000",https://www.ikea.com/kr/ko/p/jostein-shelving-unit-in-outdoor-metal-white-s19436926/,,폭:41 cm 깊이:40 cm 높이:90 cm 폭:41 cm 높이:3 cm 길이:90 cm 무게:2.40 kg 폭:37 cm 높이:2 cm 길이:40 cm 무게:1.26 kg
5,VITTSJÖ 빗셰 ,"69,900",https://www.ikea.com/kr/ko/p/vittsjoe-shelving-unit-black-brown-glass-30214679/,강화유리와 메탈 소재를 사용하여 내구성이 뛰어나며 시원하고 가벼운 느낌을 줍니다.,폭:51 cm 깊이:36 cm 높이:175 cm 선반당 최대하중:7 kg 폭:40 cm 높이:7 cm 길이:176 cm 무게:16.07 kg
5,HYLLIS 휠리스 ,"76,000",https://www.ikea.com/kr/ko/p/hyllis-shelving-unit-in-outdoor-s19318032/,"발코니의 화분, 욕실의 샴푸, 주방의 멋진 허브를 놓아두기 좋습니다. 튼튼하고 가벼우며 물을 사용하는 공간에서 사용할 수 있어요. 이렇게 큰 선반유닛이 플랫 패키지 안에 들어갈 수 있을까요?",폭:180 cm 깊이:27 cm 최소 높이:74 cm 최대 높이:140 cm 폭:30 cm 높이:4 cm 길이:74 cm 무게:3.71 kg 폭:28 cm 높이:4 cm 길이:140 cm 무게:5.50 kg
5,KALLAX 칼락스 ,"299,000",https://www.ikea.com/kr/ko/p/kallax-shelving-unit-white-10353586/,"선반유닛 또는 실내칸막이로 사용될 수 있는 KALLAX 칼락스 시리즈는 취향, 공간, 요구사항, 예산에 맞춰 선택할 수 있습니다. 부드러운 표면과 둥근 코너에서 우수한 품질을 느낄 수 있고, 인서트와 상자를 사용해 선반유닛을 맞춤 구성할 수 있어요.",폭:182 cm 깊이:39 cm 높이:182 cm 폭:41 cm 높이:8 cm 길이:187 cm 무게:12.19 kg 폭:41 cm 높이:8 cm 길이:187 cm 무게:11.73 kg 폭:40 cm 높이:7 cm 길이:180 cm 무게:29.64 kg 폭:40 cm 높이:7 cm 길이:180 cm 무게:29.64 kg
5,KALLAX 칼락스 ,"249,000",https://www.ikea.com/kr/ko/p/kallax-shelving-unit-with-4-inserts-white-s59278251/,"세로 또는 가로로 세워 사용할 수 있는 KALLAX/칼락스 시리즈는 누구나 마음에 쏙 들 거예요. 취향과 공간, 예산, 요구사항에 맞추어 구성해보세요. 서랍, 선반, 수납함, 인서트 등으로 원하는 대로 구조를 만들 수 있어요.",폭:147 cm 깊이:39 cm 높이:112 cm 선반당 최대하중:13 kg 폭:34 cm 높이:3 cm 길이:46 cm 무게:2.55 kg 폭:41 cm 높이:11 cm 길이:144 cm 무게:18.80 kg 폭:40 cm 높이:13 cm 길이:143 cm 무게:23.19 kg
5,FINNBY 핀뷔 ,"49,900",https://www.ikea.com/kr/ko/p/finnby-bookcase-black-70351443/,"책은 많은데 공간이 부족하세요? 이 얕은 책장을 활용하면 너무 많은 공간을 차지하지 않고도 시리즈 컬렉션을 보관할 수 있습니다. 침실이나 현관, 작은 거실에 알맞은 제품이죠.",폭:60 cm 깊이:24 cm 높이:180 cm 선반당 최대하중:13 kg 폭:27 cm 높이:8 cm 길이:182 cm 무게:20.77 kg
5,BILLY 빌리 / OXBERG 옥스베리 ,"129,900",https://www.ikea.com/kr/ko/p/billy-oxberg-bookcase-with-doors-white-s09281067/,세계 어디에선가 5초마다 하나의 BILLY/빌리 책장이 판매되고 있어요. 1979년에 출시한 것을 생각하면 아주 인상적인 수치죠. 세월이 흐를수록 그 멋을 더해가는 근사한 디자인 덕에 여전히 많은 사랑을 받고 있습니다.,폭:80 cm 깊이:30 cm 높이:202 cm 선반당 최대하중:30 kg 폭:29 cm 높이:14 cm 길이:207 cm 무게:40.75 kg 폭:40 cm 높이:3 cm 길이:114 cm 무게:3.11 kg
5,BILLY 빌리 ,"179,800",https://www.ikea.com/kr/ko/p/billy-bookcase-white-s99184482/,세계 어디에선가 5초마다 하나의 BILLY/빌리 책장이 판매되고 있어요. 1979년에 출시한 것을 생각하면 아주 인상적인 수치죠. 세월이 흐를수록 그 멋을 더해가는 근사한 디자인 덕에 여전히 많은 사랑을 받고 있습니다.,폭:160 cm 깊이:28 cm 높이:202 cm 선반당 최대하중:30 kg 폭:29 cm 높이:14 cm 길이:207 cm 무게:40.75 kg
5,KOLBJÖRN 콜비에른 ,"249,000",https://www.ikea.com/kr/ko/p/kolbjoern-cabinet-in-outdoor-beige-00345634/,이 넓은 키큰장에는 공구와 화분을 보관할 수 있는 넉넉한 선반이 있어요. 야외용 쿠션을 걸어두어 비바람으로부터 보호할 수 있는 옷장레일도 있어요. 실용적이면서도 스마트하죠.,폭:90 cm 깊이:35 cm 높이:161 cm 폭:40 cm 높이:13 cm 길이:185 cm 무게:27.00 kg 폭:39 cm 높이:10 cm 길이:92 cm 무게:8.80 kg
5,KALLAX 칼락스 ,"209,000",https://www.ikea.com/kr/ko/p/kallax-shelving-unit-with-4-inserts-white-s39278308/,이 KALLAX 칼락스 콤비네이션은 사용하는 공간에 따라 세우거나 수평으로 두고 거실장으로 사용할 수 있습니다. 양면이 깔끔하게 마감된 편리한 서랍과 인서트에는 잡동사니를 보이지 않게 치워둘 수 있어요.,폭:77 cm 깊이:39 cm 높이:147 cm 선반당 최대하중:13 kg 폭:34 cm 높이:4 cm 길이:73 cm 무게:4.65 kg 폭:41 cm 높이:17 cm 길이:151 cm 무게:29.60 kg 폭:34 cm 높이:3 cm 길이:46 cm 무게:2.55 kg
5,BILLY 빌리 / OXBERG 옥스베리 ,"398,800",https://www.ikea.com/kr/ko/p/billy-oxberg-bookcase-combination-w-glass-doors-oak-effect-s39483771/,유리도어를 달면 좋아하는 물건을 잘 보이게 놓아둘 수 있고 먼지도 쌓이지 않아요.,폭:160 cm 깊이:30 cm 높이:202 cm 최대하중/큰선반:30 kg 최대하중/작은선반:14 kg 폭:39 cm 높이:7 cm 길이:206 cm 무게:26.00 kg 폭:29 cm 높이:13 cm 길이:206 cm 무게:40.00 kg 폭:40 cm 높이:3 cm 길이:209 cm 무게:8.50 kg
5,DALRIPA 달리파 ,"79,900",https://www.ikea.com/kr/ko/p/dalripa-bookcase-white-90528506/,조절식 다리받침이 포함된 덕분에 고르지 않은 바닥에도 안정적으로 세워놓을 수 있어요.,깊이:32 cm 높이:150 cm 폭:60 cm 폭:34 cm 높이:9 cm 길이:174 cm 무게:29.74 kg
5,HEJNE 헤이네 ,"141,000",https://www.ikea.com/kr/ko/p/hejne-2-sections-softwood-s89031418/,"HEJNE/헤이네 수납 시스템은 견고하고 튼튼해서 차고나 지하실, 다락방 등에서 매우 무거운 물건을 보관해도 무리가 없습니다. 가공하지 않은 원목 소재 그대로 두어도 되고 스테인 처리를 하거나 페인트칠, 왁스칠을 하여 원하는 대로 꾸밀 수도 있습니다.",폭:154 cm 깊이:31 cm 높이:171 cm 선반당 최대하중:35 kg 폭:1 cm 높이:1 cm 길이:102 cm 무게:0.21 kg 폭:28 cm 높이:5 cm 길이:80 cm 무게:2.80 kg 폭:4 cm 높이:2 cm 길이:8 cm 무게:0.02 kg 폭:7 cm 높이:3 cm 길이:171 cm 무게:1.80 kg
5,BILLY 빌리 ,"39,900",https://www.ikea.com/kr/ko/p/billy-bookcase-white-60351542/,세계 어디에선가 5초마다 하나의 BILLY/빌리 책장이 판매되고 있어요. 1979년에 출시한 것을 생각하면 아주 인상적인 수치죠. 세월이 흐를수록 그 멋을 더해가는 근사한 디자인 덕에 여전히 많은 사랑을 받고 있습니다.,폭:40 cm 깊이:28 cm 높이:106 cm 선반당 최대하중:14 kg 폭:39 cm 높이:7 cm 길이:108 cm 무게:14.25 kg
5,JOSTEIN 요스테인 ,"73,900",https://www.ikea.com/kr/ko/p/jostein-shelving-unit-with-container-in-outdoor-metal-white-s09437182/,,폭:61 cm 깊이:40 cm 높이:90 cm 폭:40 cm 높이:15 cm 길이:61 cm 무게:2.69 kg 폭:41 cm 높이:3 cm 길이:90 cm 무게:2.40 kg 폭:40 cm 높이:2 cm 길이:57 cm 무게:1.82 kg
5,BILLY 빌리 ,"30,000",https://www.ikea.com/kr/ko/p/billy-height-extension-unit-white-00351564/,세계 어디에선가 5초마다 하나의 BILLY/빌리 책장이 판매되고 있어요. 1979년에 출시한 것을 생각하면 아주 인상적인 수치죠. 세월이 흐를수록 그 멋을 더해가는 근사한 디자인 덕에 여전히 많은 사랑을 받고 있습니다.,폭:80 cm 깊이:28 cm 높이:35 cm 폭:37 cm 높이:6 cm 길이:78 cm 무게:8.17 kg
5,BILLY 빌리 ,"215,700",https://www.ikea.com/kr/ko/p/billy-bookcase-combination-crnr-solution-white-s89395946/,세계 어디에선가 5초마다 하나의 BILLY/빌리 책장이 판매되고 있어요. 1979년에 출시한 것을 생각하면 아주 인상적인 수치죠. 세월이 흐를수록 그 멋을 더해가는 근사한 디자인 덕에 여전히 많은 사랑을 받고 있습니다.,"깊이:28 cm 높이:202 cm 선반당 최대하중:14 kg 폭, 왼쪽:95 cm 폭, 오른쪽:95 cm 폭:39 cm 높이:7 cm 길이:206 cm 무게:26.90 kg 폭:20 cm 높이:1 cm 길이:22 cm 무게:0.24 kg"
5,BESTÅ 베스토 ,"430,000",https://www.ikea.com/kr/ko/p/besta-storage-combination-with-doors-white-stained-oak-effect-lappviken-stubbarp-white-stained-oak-effect-s19301772/,"도어는 보호와 장식, 두 가지 기능이 있습니다. 우리 집과 수납콤비네이션에 잘 어울리는 도어를 골라보세요. ",폭:120 cm 깊이:42 cm 높이:202 cm 선반당 최대하중:20 kg 폭:60 cm 높이:2 cm 길이:73 cm 무게:4.77 kg 폭:36 cm 높이:2 cm 길이:59 cm 무게:2.30 kg 폭:20 cm 높이:3 cm 길이:25 cm 무게:0.26 kg 폭:10 cm 높이:5 cm 길이:14 cm 무게:0.42 kg 폭:41 cm 높이:8 cm 길이:196 cm 무게:20.56 kg
5,EKET 에케트 ,"25,000",https://www.ikea.com/kr/ko/p/eket-cabinet-white-30332121/,"이 스마트하고 작은 공간은 물건을 보관하거나 정돈할 때, 주머니를 비울 때 언제나 유용한 제품이에요. 눈에 띄는 색상이나 무난한 색상의 EKET 에케트를 선택해보세요.",폭:35 cm 깊이:25 cm 높이:35 cm 선반당 최대하중:5 kg 폭:34 cm 높이:8 cm 길이:38 cm 무게:3.20 kg
5,EKET 에케트 ,"10,000",https://www.ikea.com/kr/ko/p/eket-connection-fittings-20334620/,"EKET/에케트 연결장치로 디자인, 높이, 폭을 원하는 대로 조절하여 나만의 수납 콤비네이션을 손쉽게 만들 수 있습니다.",개수:12 개 폭:10 cm 높이:3 cm 길이:22 cm 무게:0.18 kg
5,JOSTEIN 요스테인 ,"113,000",https://www.ikea.com/kr/ko/p/jostein-shelving-unit-in-outdoor-wire-white-s59437207/,,폭:61 cm 깊이:40 cm 높이:180 cm 폭:41 cm 높이:3 cm 길이:90 cm 무게:2.40 kg 폭:40 cm 높이:2 cm 길이:58 cm 무게:1.42 kg
5,JOSTEIN 요스테인 ,"88,000",https://www.ikea.com/kr/ko/p/jostein-shelving-unit-in-outdoor-metal-white-s89437201/,,폭:41 cm 깊이:40 cm 높이:180 cm 폭:41 cm 높이:3 cm 길이:90 cm 무게:2.40 kg 폭:37 cm 높이:2 cm 길이:40 cm 무게:1.26 kg
5,KALLAX 칼락스 / LINNMON 린몬 ,"168,000",https://www.ikea.com/kr/ko/p/kallax-linnmon-desk-combination-white-white-stained-oak-effect-s49483445/,,폭:77 cm 깊이:139 cm 높이:147 cm 폭:7 cm 높이:5 cm 길이:41 cm 무게:0.88 kg 폭:60 cm 높이:3 cm 길이:100 cm 무게:4.81 kg 폭:12 cm 높이:7 cm 길이:59 cm 무게:1.41 kg 폭:41 cm 높이:17 cm 길이:151 cm 무게:29.60 kg
