5,BURHULT 부르훌트 / SIBBHULT 십훌트 ,"10,000",https://www.ikea.com/kr/ko/p/burhult-sibbhult-wall-shelf-combination-white-white-s69326100/,BURHULT/부르훌트를 사용하면 필요한 용도에 맞는 벽선반을 쉽게 구성할 수 있습니다. 필요한 물건을 가까이 보관하면서도 바닥 공간이 여유롭고 아끼는 물건을 진열하기에도 좋습니다.,폭:59 cm 깊이:20 cm 폭:20 cm 높이:2 cm 길이:59 cm 무게:1.27 kg 폭:18 cm 높이:3 cm 길이:18 cm 무게:0.07 kg
5,IKEA PS PENDEL 이케아 피에스 펜델 ,"229,000",https://www.ikea.com/kr/ko/p/ikea-ps-pendel-floor-clock-black-70140295/,,폭:56 cm 깊이:17 cm 높이:198 cm 폭:51 cm 높이:3 cm 길이:139 cm 무게:8.55 kg 폭:50 cm 높이:19 cm 길이:69 cm 무게:7.90 kg
5,VIHALS 비할스 ,"448,000",https://www.ikea.com/kr/ko/p/vihals-storage-combination-white-s29478039/,"VIHALS 비할스 수납 시리즈는 집 안 전체의 방을 이어주는 통일감 있는 스타일을 연출해요. 서랍과 선반을 믹스한 솔루션으로 다이닝 공간, 현관을 비롯한 그 어떤 곳에서도 물건을 잘 정돈할 수 있어요.",깊이:37 cm 높이:200 cm 폭:235 cm 최대하중/작은선반:9 kg 최대하중/큰선반:15 kg 폭:39 cm 높이:8 cm 길이:156 cm 무게:24.70 kg 폭:38 cm 높이:10 cm 길이:144 cm 무게:29.10 kg 폭:38 cm 높이:7 cm 길이:202 cm 무게:26.80 kg 폭:38 cm 높이:8 cm 길이:202 cm 무게:31.23 kg
5,EKET 에케트 ,"40,000",https://www.ikea.com/kr/ko/p/eket-wall-mounted-shelving-unit-white-s29285818/,"이 스마트하고 작은 공간은 물건을 보관하거나 정돈할 때, 주머니를 비울 때 언제나 유용한 제품이에요. 눈에 띄는 색상이나 무난한 색상의 EKET 에케트를 선택해보세요.",폭:35 cm 깊이:35 cm 높이:35 cm 폭:36 cm 높이:8 cm 길이:41 cm 무게:4.10 kg 폭:9 cm 높이:3 cm 길이:33 cm 무게:0.33 kg
5,EKET 에케트 ,"10,000",https://www.ikea.com/kr/ko/p/eket-suspension-rail-20340051/,서스펜션 레일이 있어 더욱 쉽고 안전하게 EKET/에케트를 벽에 설치할 수 있습니다.,폭:63 cm 깊이:1.5 cm 높이:4 cm 프레임 폭:70 cm 폭:9 cm 높이:3 cm 길이:66 cm 무게:0.69 kg
5,HÖGBO 회그보 ,"35,000",https://www.ikea.com/kr/ko/p/hoegbo-glass-door-black-00530250/,조절식 경첩으로 도어의 방향을 자유롭게 선택할 수 있습니다.,높이:97 cm 폭:40 cm 폭:40 cm 높이:3 cm 길이:110 cm 무게:4.80 kg
5,VITTSJÖ 빗셰 ,"159,800",https://www.ikea.com/kr/ko/p/vittsjoe-storage-combination-black-brown-glass-s89294527/,단순한 디자인에 유리 선반을 달아 물건을 돋보이게 진열할 수 있습니다. 위/아래 패널은 블랙브라운과 블랙 색상의 면이 하나씩 있어서 가장 마음에 드는 느낌을 선택할 수 있어요.,폭:200 cm 깊이:36 cm 높이:93 cm 폭:38 cm 높이:11 cm 길이:104 cm 무게:14.85 kg
5,BERGSHULT 베리스훌트 ,"13,900",https://www.ikea.com/kr/ko/p/bergshult-shelf-white-80430510/,"벽선반의 긴 측면 한편은 경사진 가장자리, 반대편은 매끄러운 가장자리여서 선호하는 스타일에 따라 원하는 면을 선택할 수 있습니다.",폭:80 cm 깊이:20 cm 두께:2.5 cm 최대 하중:10 kg 폭:21 cm 높이:3 cm 길이:87 cm 무게:2.87 kg
5,HAVSTA 하브스타 ,"269,000",https://www.ikea.com/kr/ko/p/havsta-shelving-unit-with-plinth-white-s69275092/,지속가능한 방식으로 생산한 목재를 사용했습니다.,폭:81 cm 깊이:37 cm 높이:134 cm 선반당 최대하중:26 kg 폭:39 cm 높이:12 cm 길이:163 cm 무게:27.45 kg 폭:12 cm 높이:6 cm 길이:103 cm 무게:3.10 kg
5,BERGSHULT 베리스훌트 / RAMSHULT 람스훌트 ,"30,900",https://www.ikea.com/kr/ko/p/bergshult-ramshult-wall-shelf-white-s49325470/,"벽선반을 사용하여 빈 벽면을 물건으로 장식해보세요. 침실은 물론 거실의 다용도수납장이나 식탁 옆 전시용선반 등, 원하는 대로 활용할 수 있습니다.",폭:80 cm 깊이:30 cm 최대 하중:10 kg 폭:31 cm 높이:3 cm 길이:87 cm 무게:4.39 kg 폭:19 cm 높이:4 cm 길이:22 cm 무게:0.30 kg
5,BILLY 빌리 / OXBERG 옥스베리 ,"329,800",https://www.ikea.com/kr/ko/p/billy-oxberg-bookcase-with-panel-glass-doors-s59477298/,세계 어디에선가 5초마다 하나의 BILLY/빌리 책장이 판매되고 있어요. 1979년에 출시한 것을 생각하면 아주 인상적인 수치죠. 세월이 흐를수록 그 멋을 더해가는 근사한 디자인 덕에 여전히 많은 사랑을 받고 있습니다.,선반당 최대하중:30 kg 높이:202 cm 깊이:30 cm 폭:160 cm 폭:29 cm 높이:14 cm 길이:207 cm 무게:40.75 kg 폭:40 cm 높이:3 cm 길이:209 cm 무게:7.50 kg 폭:40 cm 높이:3 cm 길이:113 cm 무게:4.90 kg
5,BURHULT 부르훌트 / SIBBHULT 십훌트 ,"5,000",https://www.ikea.com/kr/ko/p/burhult-sibbhult-wall-shelf-white-white-s69325964/,BURHULT/부르훌트를 사용하면 필요한 용도에 맞는 벽선반을 쉽게 구성할 수 있습니다. 필요한 물건을 가까이 보관하면서도 바닥 공간이 여유롭고 아끼는 물건을 진열하기에도 좋습니다.,폭:59 cm 깊이:20 cm 최대 하중:10 kg 폭:20 cm 높이:2 cm 길이:59 cm 무게:1.27 kg 폭:18 cm 높이:3 cm 길이:18 cm 무게:0.07 kg
5,KOLBJÖRN 콜비에른 ,"428,800",https://www.ikea.com/kr/ko/p/kolbjoern-shelving-unit-with-cabinet-beige-s89291623/,이 넓은 키큰장에는 공구와 화분을 보관할 수 있는 넉넉한 선반이 있어요. 야외용 쿠션을 걸어두어 비바람으로부터 보호할 수 있는 옷장레일도 있어요. 실용적이면서도 스마트하죠.,폭:171 cm 깊이:37 cm 높이:161 cm 폭:40 cm 높이:13 cm 길이:185 cm 무게:27.00 kg 폭:39 cm 높이:10 cm 길이:92 cm 무게:8.80 kg 폭:36 cm 높이:13 cm 길이:82 cm 무게:11.23 kg
5,BOAXEL 보악셀 ,"124,000",https://www.ikea.com/kr/ko/p/boaxel-wardrobe-combination-white-s59332366/,한정된 공간에도 생각보다 더 많이 수납할 수 있어요. 간편하게 설치할 수 있는 BOAXEL 보악셀 벽고정 수납시스템으로 그동안 침실과 작은 붙박이장에 쌓아두었던 옷과 신발을 모두 정리해 보세요.,폭:62.0 cm 깊이:40.0 cm 높이:200.6 cm 폭:38 cm 높이:15 cm 길이:60 cm 무게:1.35 kg 폭:8 cm 높이:1 cm 길이:40 cm 무게:0.24 kg 폭:2 cm 높이:1 cm 길이:62 cm 무게:0.14 kg 폭:3 cm 높이:3 cm 길이:200 cm 무게:1.21 kg 폭:3 cm 높이:3 cm 길이:62 cm 무게:0.28 kg 폭:39 cm 높이:2 cm 길이:61 cm 무게:3.21 kg
5,BOAXEL 보악셀 ,"4,000",https://www.ikea.com/kr/ko/p/boaxel-wall-upright-white-00453567/,이 벽고정대는 BOAXEL 보악셀 벽고정 수납시스템의 기초를 이룹니다. 필요한 벽고정대 수를 결정한 다음 내부 구성품을 추가해 맞춤형 신발 및 옷 수납시스템을 완성해보세요.,높이:100 cm 폭:2 cm 폭:3 cm 높이:3 cm 길이:100 cm 무게:0.62 kg
5,BOAXEL 보악셀 ,"4,000",https://www.ikea.com/kr/ko/p/boaxel-mounting-rail-white-60453531/,"약간 비뚤어지고 구부러져도 괜찮을 때가 있지만, 수납시스템을 설치할 땐 곤란해요. 이 고정용 레일을 사용하면 BOAXEL 보악셀 벽고정대를 벽에 수직으로 똑바르게 걸 수 있어요.",길이:62.4 cm 폭:2 cm 높이:1 cm 길이:62 cm 무게:0.14 kg
5,EKET 에케트 ,"5,000",https://www.ikea.com/kr/ko/p/eket-suspension-rail-60340049/,서스펜션 레일이 있어 더욱 쉽고 안전하게 EKET/에케트를 벽에 설치할 수 있습니다.,폭:29.5 cm 깊이:1.5 cm 높이:4 cm 프레임 폭:35 cm 폭:9 cm 높이:3 cm 길이:33 cm 무게:0.33 kg
5,PERSHULT 페르스훌트 ,"4,500",https://www.ikea.com/kr/ko/p/pershult-bracket-white-40430545/,PERSHULT/페르스훌트 브래킷으로 개성 있는 벽선반을 꾸며보세요. 두 개의 선반을 연결하여 대형 콤비네이션을 구성할 때 잘 맞도록 디자인한 브래킷이어서 원하는 분위기에 맞추어 설치할 수 있습니다.,깊이:20 cm 높이:30 cm 폭:22 cm 높이:1 cm 길이:31 cm 무게:0.25 kg
5,GULLHULT 굴훌트 ,"19,900",https://www.ikea.com/kr/ko/p/gullhult-wall-shelf-black-pine-antique-effect-40489022/,"지갑, 장갑, 충전기, 리모컨 등, 작은 물건을 보관하기 편리합니다.",폭:30 cm 깊이:21 cm 높이:40 cm 선반당 최대하중:6 kg 폭:22 cm 높이:6 cm 길이:73 cm 무게:1.92 kg
5,HEJNE 헤이네 ,"20,000",https://www.ikea.com/kr/ko/p/hejne-shelf-softwood-40287811/,무가공 원목은 내구성이 뛰어난 천연소재로 오일이나 왁스를 칠하면 내구성이 높아지고 관리도 편해집니다.,폭:77.0 cm 깊이:28.0 cm 최대 하중:35 kg 개수:2 개 폭:28 cm 높이:5 cm 길이:80 cm 무게:2.80 kg
5,EKET 에케트 ,"460,000",https://www.ikea.com/kr/ko/p/eket-cabinet-combination-with-feet-white-s39221086/,"근사하고 독창적인 나만의 수납공간을 디자인해보세요. 바닥에 세워두거나 벽에 설치할 수도 있고, 필요에 따라 무한대로 확장할 수도 있습니다.",길이:70 cm 폭:140 cm 깊이:35 cm 높이:212 cm 폭:10 cm 높이:3 cm 길이:22 cm 무게:0.18 kg 폭:20 cm 높이:3 cm 길이:20 cm 무게:0.35 kg 폭:36 cm 높이:13 cm 길이:76 cm 무게:16.90 kg 폭:36 cm 높이:12 cm 길이:76 cm 무게:11.90 kg
5,HAVSTA 하브스타 ,"907,000",https://www.ikea.com/kr/ko/p/havsta-storage-combination-dark-brown-s59275139/,"오픈 선반에는 아끼는 소품을 디스플레이하고, 다른 자잘한 물건은 보이지 않는 곳에 정리해보세요. 브러쉬 마감의 원목 디테일은 시간이 지나도 멋스럽습니다.",폭:142 cm 깊이:47 cm 높이:212 cm 선반당 최대하중:20 kg 폭:49 cm 높이:18 cm 길이:92 cm 무게:28.30 kg 폭:39 cm 높이:9 cm 길이:74 cm 무게:9.60 kg 폭:39 cm 높이:9 cm 길이:203 cm 무게:22.70 kg 폭:39 cm 높이:12 cm 길이:95 cm 무게:16.30 kg 폭:42 cm 높이:9 cm 길이:125 cm 무게:17.00 kg
5,FJÄLKINGE 피엘킹에 ,"658,000",https://www.ikea.com/kr/ko/p/fjaelkinge-shelving-unit-with-drawers-white-s79254975/,"튼튼한 스틸 구조로 되어 있으나 가볍고 경쾌한 느낌을 주는 디자인이에요. 좋아하는 물건은 보이게 두고, 지저분해 보이기 쉬운 작은 물건들은 매끄럽고 부드럽게 닫히는 서랍 안에 보관하세요.",폭:236 cm 깊이:35 cm 높이:193 cm 선반당 최대하중:40 kg 폭:41 cm 높이:7 cm 길이:128 cm 무게:18.65 kg 폭:36 cm 높이:12 cm 길이:120 cm 무게:28.04 kg 폭:6 cm 높이:5 cm 길이:191 cm 무게:7.50 kg
5,BILLY 빌리 ,"329,700",https://www.ikea.com/kr/ko/p/billy-bookcase-comb-with-extension-units-black-oak-effect-s59483727/,높이조절유닛을 활용하면 벽공간을 최대한 넓게 활용할 수 있습니다.,폭:120 cm 깊이:28 cm 높이:237 cm 선반당 최대하중:14 kg 폭:39 cm 높이:7 cm 길이:206 cm 무게:26.00 kg 폭:37 cm 높이:8 cm 길이:38 cm 무게:5.20 kg
5,BROR 브로르 ,"85,000",https://www.ikea.com/kr/ko/p/bror-1-section-shelves-black-s19272642/,중량감 있는 금속을 IKEA 고유의 방식으로 재해석한 수납 시스템으로 튼튼하고 내구성이 뛰어나며 유연하게 활용할 수 있습니다. 또한 조립이 간편하고 필요에 따라 조합하여 사용하기 쉬우며 견고한 제품으로 습기와 오염에 강하고 무거운 물건을 올려 두어도 무리가 없습니다.,폭:65 cm 깊이:40 cm 높이:110 cm 폭:6 cm 높이:6 cm 길이:126 cm 무게:3.74 kg 폭:39 cm 높이:2 cm 길이:64 cm 무게:2.31 kg
5,JOSTEIN 요스테인 ,"446,000",https://www.ikea.com/kr/ko/p/jostein-shelving-unit-with-doors-in-outdoor-white-s09437295/,,폭:182 cm 깊이:44 cm 높이:180 cm 폭:40 cm 높이:7 cm 길이:85 cm 무게:10.14 kg 폭:40 cm 높이:2 cm 길이:77 cm 무게:2.70 kg 폭:41 cm 높이:7 cm 길이:84 cm 무게:11.56 kg 폭:41 cm 높이:3 cm 길이:90 cm 무게:2.40 kg 폭:42 cm 높이:6 cm 길이:85 cm 무게:8.06 kg 폭:37 cm 높이:2 cm 길이:40 cm 무게:1.26 kg 폭:40 cm 높이:2 cm 길이:57 cm 무게:1.82 kg
5,JOSTEIN 요스테인 ,"177,800",https://www.ikea.com/kr/ko/p/jostein-shelving-unit-with-grid-in-outdoor-wire-white-s69437259/,,폭:82 cm 깊이:40 cm 높이:180 cm 폭:40 cm 높이:1 cm 길이:88 cm 무게:1.02 kg 폭:40 cm 높이:2 cm 길이:77 cm 무게:1.97 kg 폭:41 cm 높이:3 cm 길이:90 cm 무게:2.40 kg
5,KALLAX 칼락스 / LAGKAPTEN 락캅텐 ,"188,000",https://www.ikea.com/kr/ko/p/kallax-lagkapten-desk-combination-white-s89483453/,,폭:77 cm 깊이:159 cm 높이:147 cm 폭:7 cm 높이:5 cm 길이:41 cm 무게:0.88 kg 폭:41 cm 높이:17 cm 길이:151 cm 무게:29.60 kg 폭:60 cm 높이:3 cm 길이:120 cm 무게:7.09 kg 폭:12 cm 높이:7 cm 길이:59 cm 무게:1.41 kg
5,KALLAX 칼락스 / LAGKAPTEN 락캅텐 ,"278,000",https://www.ikea.com/kr/ko/p/kallax-lagkapten-desk-combination-white-s09483471/,,폭:147 cm 깊이:159 cm 높이:147 cm 폭:7 cm 높이:5 cm 길이:41 cm 무게:0.88 kg 폭:60 cm 높이:3 cm 길이:120 cm 무게:7.09 kg 폭:40 cm 높이:16 cm 길이:152 cm 무게:20.10 kg 폭:40 cm 높이:11 cm 길이:144 cm 무게:34.86 kg 폭:12 cm 높이:7 cm 길이:59 cm 무게:1.41 kg
5,SPORTSLIG 스포르트슬리그 ,"19,900",https://www.ikea.com/kr/ko/p/sportslig-wall-shelf-for-trophies-white-birch-00504232/,,깊이:20 cm 높이:30 cm 최대 하중:10 kg 폭:50 cm 폭:20 cm 높이:6 cm 길이:52 cm 무게:2.16 kg
5,JOSTEIN 요스테인 ,"137,900",https://www.ikea.com/kr/ko/p/jostein-shelving-unit-with-bags-in-outdoor-wire-transparent-white-s19437271/,,폭:61 cm 최소 깊이:40 cm 최대 깊이:76 cm 높이:180 cm 폭:57 cm 높이:2 cm 길이:75 cm 무게:2.61 kg 폭:41 cm 높이:3 cm 길이:90 cm 무게:2.40 kg 폭:40 cm 높이:2 cm 길이:58 cm 무게:1.42 kg
5,VITTSJÖ 빗셰 ,"168,900",https://www.ikea.com/kr/ko/p/vittsjoe-shelving-unit-with-laptop-table-black-brown-glass-s09902665/,유리와 메탈 소재를 사용하여 내구성이 뛰어나며 가볍고 경쾌한 느낌을 줍니다.,폭:200 cm 깊이:36 cm 최소 높이:74 cm 최대 높이:175 cm 폭:40 cm 높이:7 cm 길이:104 cm 무게:10.48 kg 폭:40 cm 높이:10 cm 길이:202 cm 무게:28.38 kg
5,BILLY 빌리 ,"5,000",https://www.ikea.com/kr/ko/p/billy-extra-shelf-white-60351556/,세계 어디에선가 5초마다 하나의 BILLY/빌리 책장이 판매되고 있어요. 1979년에 출시한 것을 생각하면 아주 인상적인 수치죠. 세월이 흐를수록 그 멋을 더해가는 근사한 디자인 덕에 여전히 많은 사랑을 받고 있습니다.,폭:36 cm 깊이:26 cm 두께:2 cm 선반당 최대하중:14 kg 폭:26 cm 높이:2 cm 길이:37 cm 무게:1.32 kg
5,EKET 에케트 ,"320,000",https://www.ikea.com/kr/ko/p/eket-wall-mounted-cabinet-combination-white-s49494279/,벽면 장착형 EKET/에케트를 사용하면 벽 공간을 최대한 활용하고 바닥에 여유 공간을 확보할 수 있습니다.,길이:70 cm 폭:175 cm 깊이:35 cm 높이:70 cm 폭:9 cm 높이:3 cm 길이:66 cm 무게:0.69 kg 폭:36 cm 높이:8 cm 길이:41 cm 무게:4.10 kg 폭:9 cm 높이:3 cm 길이:33 cm 무게:0.33 kg 폭:36 cm 높이:13 cm 길이:76 cm 무게:16.90 kg
5,BOAXEL 보악셀 ,"221,500",https://www.ikea.com/kr/ko/p/boaxel-shelving-unit-white-oak-s59384181/,한정된 공간에도 생각보다 더 많이 수납할 수 있어요. 간편하게 설치할 수 있는 BOAXEL 보악셀 벽고정 수납시스템으로 그동안 침실과 작은 붙박이장에 쌓아두었던 옷과 신발을 모두 정리해 보세요.,폭:187.2 cm 깊이:40.0 cm 높이:100.6 cm 폭:3 cm 높이:3 cm 길이:100 cm 무게:0.62 kg 폭:8 cm 높이:1 cm 길이:40 cm 무게:0.24 kg 폭:39 cm 높이:2 cm 길이:61 cm 무게:3.20 kg 폭:2 cm 높이:1 cm 길이:62 cm 무게:0.14 kg
5,BILLY 빌리 / HÖGBO 회그보 ,"84,900",https://www.ikea.com/kr/ko/p/billy-hoegbo-bookcase-combination-w-glass-doors-black-oak-effect-black-s89494550/,조절식 경첩으로 도어의 방향을 자유롭게 선택할 수 있습니다.,깊이:30 cm 높이:106 cm 선반당 최대하중:14 kg 폭:40 cm 폭:40 cm 높이:3 cm 길이:110 cm 무게:4.80 kg 폭:39 cm 높이:7 cm 길이:108 cm 무게:14.35 kg
5,BOAXEL 보악셀 ,"12,500",https://www.ikea.com/kr/ko/p/boaxel-mesh-basket-white-00453529/,스웨터와 양말부터 신발과 가방까지 모든 물건을 완벽하게 보관할 수 있어요. BOAXEL 보악셀 벽고정 수납시스템과 메시바구니로 물건과 필요에 맞는 솔루션을 완성할 수 있어요.,"최대 하중/바구니:6 kg 깊이:15.0 cm 프레임, 깊이:40.0 cm 프레임 폭:60.0 cm 폭:38 cm 높이:15 cm 길이:60 cm 무게:1.35 kg"
5,FJÄLKINGE 피엘킹에 ,"528,000",https://www.ikea.com/kr/ko/p/fjaelkinge-shelving-unit-with-drawers-white-s39254977/,"튼튼한 스틸 구조로 되어 있으나 가볍고 경쾌한 느낌을 주는 디자인이에요. 좋아하는 물건은 보이게 두고, 지저분해 보이기 쉬운 작은 물건들은 매끄럽고 부드럽게 닫히는 서랍 안에 보관하세요.",폭:236 cm 깊이:35 cm 높이:193 cm 선반당 최대하중:40 kg 폭:41 cm 높이:7 cm 길이:128 cm 무게:18.65 kg 폭:36 cm 높이:12 cm 길이:120 cm 무게:28.04 kg 폭:6 cm 높이:5 cm 길이:191 cm 무게:7.50 kg
5,EKET 에케트 ,"50,000",https://www.ikea.com/kr/ko/p/eket-wall-cabinet-with-glass-door-white-s09336357/,"이 스마트하고 작은 공간은 물건을 보관하거나 정돈할 때, 주머니를 비울 때 언제나 유용한 제품이에요. 눈에 띄는 색상이나 무난한 색상의 EKET 에케트를 선택해보세요.",폭:35 cm 깊이:25 cm 높이:35 cm 폭:34 cm 높이:8 cm 길이:38 cm 무게:3.20 kg 폭:9 cm 높이:3 cm 길이:33 cm 무게:0.33 kg 폭:32 cm 높이:3 cm 길이:40 cm 무게:1.48 kg
5,BILLY 빌리 / OXBERG 옥스베리 ,"589,700",https://www.ikea.com/kr/ko/p/billy-oxberg-bookcase-white-s99184528/,높이조절유닛을 활용하면 벽공간을 최대한 넓게 활용할 수 있습니다.,폭:200 cm 깊이:30 cm 높이:237 cm 선반당 최대하중:30 kg 폭:37 cm 높이:6 cm 길이:78 cm 무게:8.17 kg 폭:29 cm 높이:14 cm 길이:207 cm 무게:40.75 kg 폭:40 cm 높이:3 cm 길이:51 cm 무게:2.00 kg 폭:39 cm 높이:7 cm 길이:206 cm 무게:26.90 kg 폭:37 cm 높이:8 cm 길이:38 cm 무게:5.04 kg 폭:40 cm 높이:3 cm 길이:209 cm 무게:9.26 kg
5,BILLY 빌리 / OXBERG 옥스베리 ,"299,700",https://www.ikea.com/kr/ko/p/billy-oxberg-bookcase-with-doors-s29477426/,세계 어디에선가 5초마다 하나의 BILLY/빌리 책장이 판매되고 있어요. 1979년에 출시한 것을 생각하면 아주 인상적인 수치죠. 세월이 흐를수록 그 멋을 더해가는 근사한 디자인 덕에 여전히 많은 사랑을 받고 있습니다.,폭:200 cm 깊이:30 cm 높이:106 cm 선반당 최대하중:30 kg 폭:39 cm 높이:7 cm 길이:108 cm 무게:14.25 kg 폭:40 cm 높이:3 cm 길이:113 cm 무게:4.90 kg 폭:30 cm 높이:15 cm 길이:108 cm 무게:22.90 kg
5,BILLY 빌리 / OXBERG 옥스베리 ,"129,900",https://www.ikea.com/kr/ko/p/billy-oxberg-bookcase-with-doors-s09477286/,세계 어디에선가 5초마다 하나의 BILLY/빌리 책장이 판매되고 있어요. 1979년에 출시한 것을 생각하면 아주 인상적인 수치죠. 세월이 흐를수록 그 멋을 더해가는 근사한 디자인 덕에 여전히 많은 사랑을 받고 있습니다.,선반당 최대하중:30 kg 깊이:30 cm 폭:80 cm 높이:106 cm 폭:40 cm 높이:3 cm 길이:113 cm 무게:4.90 kg 폭:30 cm 높이:15 cm 길이:108 cm 무게:22.90 kg
5,VIHALS 비할스 ,"248,900",https://www.ikea.com/kr/ko/p/vihals-storage-combination-white-s99478050/,VIHALS 비할스 수납 시리즈는 집 안 전체의 방을 이어주는 통일감 있는 스타일을 연출해요. 이 콤비네이션은 간결한 디자인과 기능성 덕분에 다양한 수납 요구사항에 대응하고 어디에든 잘 어울려요.,깊이:47 cm 높이:90 cm 폭:190 cm 최대하중/작은선반:9 kg 최대하중/큰선반:15 kg 폭:48 cm 높이:9 cm 길이:102 cm 무게:25.00 kg 폭:48 cm 높이:8 cm 길이:99 cm 무게:20.00 kg 폭:38 cm 높이:14 cm 길이:100 cm 무게:29.20 kg
5,KALLAX 칼락스 / LAGKAPTEN 락캅텐 ,"198,000",https://www.ikea.com/kr/ko/p/kallax-lagkapten-desk-combination-white-s59483459/,,폭:77 cm 깊이:179 cm 높이:147 cm 폭:7 cm 높이:5 cm 길이:41 cm 무게:0.88 kg 폭:41 cm 높이:17 cm 길이:151 cm 무게:29.60 kg 폭:61 cm 높이:4 cm 길이:141 cm 무게:8.75 kg 폭:12 cm 높이:7 cm 길이:59 cm 무게:1.41 kg
5,OXBERG 옥스베리 ,"20,000",https://www.ikea.com/kr/ko/p/oxberg-glass-door-birch-effect-80524636/,조절식 경첩으로 도어의 방향을 자유롭게 선택할 수 있습니다.,폭:40 cm 높이:35 cm 폭:40 cm 높이:3 cm 길이:51 cm 무게:2.00 kg
5,HAVSTA 하브스타 ,"40,000",https://www.ikea.com/kr/ko/p/havsta-plinth-dark-brown-30391078/,"수공예 디테일 장식에 표면을 브러시 처리한 원목 소재의 하부몰딩을 더하면 HAVSTA/하브스타 유닛을 겹쳐 쌓아서 단독으로 사용할 수 있으며, 유행을 타지 않는 자연 그대로의 느낌을 주고 통일성 있는 분위기를 더할 수 있습니다.","폭:81 cm 깊이:37 cm 높이:12 cm 프레임, 깊이:35 cm 폭:12 cm 높이:6 cm 길이:103 cm 무게:3.10 kg"
5,VITTSJÖ 빗셰 ,"79,900",https://www.ikea.com/kr/ko/p/vittsjoe-shelving-unit-black-brown-glass-20305806/,강화유리와 메탈 소재를 사용하여 내구성이 뛰어나며 시원하고 가벼운 느낌을 줍니다.,상단패널 최대 하중:30 kg 폭:100 cm 깊이:36 cm 높이:93 cm 선반당 최대하중:15 kg 폭:38 cm 높이:11 cm 길이:104 cm 무게:14.85 kg
5,BROR 브로르 ,"199,000",https://www.ikea.com/kr/ko/p/bror-trolley-black-pine-plywood-40333851/,IKEA식으로 디자인한 견고한 수납 시스템으로 습기와 오염에 강하고 무거운 물건을 올려 두어도 무리가 없습니다. 또한 조립이 간편하고 필요에 따라 조합하여 사용하기 쉬우며 깔끔한 디자인 덕분에 어디에 두어도 잘 어울립니다.,길이:85 cm 폭:55 cm 높이:88 cm 최대 하중:50 kg 폭:56 cm 높이:17 cm 길이:86 cm 무게:21.45 kg
5,BOAXEL 보악셀 ,"10,000",https://www.ikea.com/kr/ko/p/boaxel-shelf-metal-white-90453539/,"BOAXEL 보악셀 선반에는 스웨터, 모자, 가방, 수납함을 비롯한 모든 물건을 보관할 수 있어요. 다양한 크기와 스타일이 있어 BOAXEL 보악셀 벽고정 수납시스템으로 맞춤형 솔루션을 구성할 수 있죠.",폭:60 cm 깊이:40 cm 최대 하중:24 kg 폭:38 cm 높이:2 cm 길이:60 cm 무게:1.64 kg
5,VIHALS 비할스 ,"149,000",https://www.ikea.com/kr/ko/p/vihals-shelving-unit-with-6-shelves-white-60483284/,VIHALS 비할스 수납 시리즈는 집 안 전체의 방을 이어주는 통일감 있는 스타일을 연출해요. 하나만 사용하거나 여러 유닛을 조합해보세요. 잘 정렬되어 있는 선반은 언제나 아름답고 통일감 있는 룩을 완성해주죠.,깊이:37 cm 높이:140 cm 폭:95 cm 최대하중/작은선반:9 kg 최대하중/큰선반:15 kg 폭:38 cm 높이:8 cm 길이:142 cm 무게:24.60 kg 폭:36 cm 높이:6 cm 길이:146 cm 무게:17.20 kg
5,JOSTEIN 요스테인 ,"125,900",https://www.ikea.com/kr/ko/p/jostein-shelving-unit-with-cover-in-outdoor-wire-transparent-white-s49437217/,커버를 덮으면 JOSTEIN 요스테인 선반유닛이 도어수납으로 변신해 먼지와 비를 막아줍니다.,폭:61 cm 깊이:41 cm 높이:180 cm 폭:12 cm 높이:8 cm 길이:35 cm 무게:0.51 kg 폭:41 cm 높이:3 cm 길이:90 cm 무게:2.40 kg 폭:40 cm 높이:2 cm 길이:58 cm 무게:1.42 kg
5,BILLY 빌리 / OXBERG 옥스베리 ,"439,800",https://www.ikea.com/kr/ko/p/billy-oxberg-bookcase-w-height-extension-ut-drs-white-clear-glass-s79477424/,장식용 패널이 끼워진 도어 솔루션으로 잡동사니는 보이지 않게 감추고 공간에 클래식한 느낌을 더할 수 있어요. 길이연장유닛을 사용하면 수납공간의 수준을 새로운 차원으로 높이고 벽공간을 최대한 활용할 수 있어요.,폭:160 cm 깊이:30 cm 높이:237 cm 선반당 최대하중:30 kg 폭:37 cm 높이:6 cm 길이:78 cm 무게:8.17 kg 폭:29 cm 높이:14 cm 길이:207 cm 무게:40.75 kg 폭:40 cm 높이:3 cm 길이:114 cm 무게:3.11 kg 폭:40 cm 높이:3 cm 길이:113 cm 무게:4.90 kg
5,BILLY 빌리 / OXBERG 옥스베리 ,"359,800",https://www.ikea.com/kr/ko/p/billy-oxberg-bookcase-white-s99228754/,세계 어디에선가 5초마다 하나의 BILLY/빌리 책장이 판매되고 있어요. 1979년에 출시한 것을 생각하면 아주 인상적인 수치죠. 세월이 흐를수록 그 멋을 더해가는 근사한 디자인 덕에 여전히 많은 사랑을 받고 있습니다.,폭:160 cm 깊이:30 cm 높이:202 cm 선반당 최대하중:30 kg 폭:29 cm 높이:14 cm 길이:207 cm 무게:40.75 kg 폭:40 cm 높이:3 cm 길이:209 cm 무게:7.50 kg
5,HEJNE 헤이네 ,"1,000",https://www.ikea.com/kr/ko/p/hejne-end-protector-grey-70286674/,HEJNE/헤이네 절단면에 끼우면 습기와 먼지를 막을 수 있습니다. ,개수:2 개 폭:4 cm 높이:2 cm 길이:8 cm 무게:0.02 kg
5,BILLY 빌리 ,"119,900",https://www.ikea.com/kr/ko/p/billy-bookcase-white-s89217713/,높이조절유닛을 활용하면 벽공간을 최대한 넓게 활용할 수 있습니다.,폭:80 cm 깊이:28 cm 높이:237 cm 선반당 최대하중:30 kg 폭:37 cm 높이:6 cm 길이:78 cm 무게:8.17 kg 폭:29 cm 높이:14 cm 길이:207 cm 무게:40.75 kg
